{
  "id": "chinaosc2026",
  "source_url": "https://chinaosc.ccf.org.cn/",
  "name": {
    "zh": "2026 CCF中国开源大会",
    "en": "CCF ChinaOSC 2026"
  },
  "start_date": "2026-08-14",
  "end_date": "2026-08-16",
  "timezone": "Asia/Shanghai",
  "links": {
    "official": "https://chinaosc.ccf.org.cn/",
    "register": "https://ccf.org.cn/2026COSC"
  },
  "venues": [
    {
      "id": "cq-sciic",
      "name": {
        "zh": "重庆・山城国际会议中心",
        "en": null
      },
      "type": "main",
      "city": "重庆"
    }
  ],
  "organizations": [
    {
      "name": {
        "zh": "中国计算机学会",
        "en": "CCF"
      },
      "role": "host",
      "sponsor_tier": null
    },
    {
      "name": {
        "zh": "CCF开源发展技术委员会",
        "en": null
      },
      "role": "co_host",
      "sponsor_tier": null
    },
    {
      "name": {
        "zh": "重庆大学",
        "en": null
      },
      "role": "co_host",
      "sponsor_tier": null
    },
    {
      "name": {
        "zh": "GitLink",
        "en": null
      },
      "role": "support",
      "sponsor_tier": null,
      "logo": {
        "local_path": null,
        "source_url": "https://gateway.gitlink.org.cn/api/file/statics/2026/06/22/GitLink logo黑色_20260622104102A166.png"
      },
      "extra": {
        "partner_type": "合作社区"
      }
    },
    {
      "name": {
        "zh": "AI Infra开源社区",
        "en": null
      },
      "role": "support",
      "sponsor_tier": null,
      "logo": {
        "local_path": null,
        "source_url": "https://gateway.gitlink.org.cn/api/file/statics/2026/06/22/AI INFRA(1)_20260622104409A167.png"
      },
      "extra": {
        "partner_type": "合作社区"
      }
    },
    {
      "name": {
        "zh": "浙大太乙",
        "en": null
      },
      "role": "support",
      "sponsor_tier": null,
      "logo": {
        "local_path": null,
        "source_url": "https://gateway.gitlink.org.cn/api/file/statics/2026/07/29/taiyi_20260729105455A622.svg"
      },
      "extra": {
        "partner_type": "合作社区"
      }
    }
  ],
  "committees": [
    {
      "role": {
        "zh": "大会主席",
        "en": null
      },
      "ordering_note": null,
      "members": [
        {
          "name": "王怀民",
          "affiliation_raw": "大会主席，中国科学院院士，国防科技大学教授，计算机软件与理论专家，主要从事分布计算、软件工程、操作系统等领域的研究。",
          "photo": {
            "local_path": null,
            "source_url": "https://gateway.gitlink.org.cn/api/file/statics/2026/07/22/王怀民_20260722165407A370.jpg"
          }
        },
        {
          "name": "刘昌胜",
          "affiliation_raw": "大会主席，中国科学院院士、重庆大学校长",
          "photo": {
            "local_path": null,
            "source_url": "https://gateway.gitlink.org.cn/api/file/statics/2026/07/22/刘昌盛_20260722172805A373.jpg"
          }
        }
      ]
    },
    {
      "role": {
        "zh": "与会嘉宾",
        "en": null
      },
      "ordering_note": null,
      "members": [
        {
          "name": "陈左宁",
          "affiliation_raw": "中国工程院院士、中国工程院原副院长",
          "photo": {
            "local_path": null,
            "source_url": "https://gateway.gitlink.org.cn/api/file/statics/2026/06/18/陈左宁-新_20250620185346A290_20260618104238A125.jpg"
          }
        },
        {
          "name": "丁奎岭",
          "affiliation_raw": "中国科学院院士、上海交通大学校长",
          "photo": {
            "local_path": null,
            "source_url": "https://gateway.gitlink.org.cn/api/file/statics/2026/06/18/丁奎岭_20250619112633A243_20260618104430A126.jpg"
          }
        },
        {
          "name": "鄂维南",
          "affiliation_raw": "中国科学院院士、北京大学教授、上海交通大学人工智能学院首席顾问",
          "photo": {
            "local_path": null,
            "source_url": "https://gateway.gitlink.org.cn/api/file/statics/2026/06/18/鄂维南_20250617112119A190_20260618104940A127.png"
          }
        },
        {
          "name": "梅宏",
          "affiliation_raw": "中国科学院院士、北京大学教授",
          "photo": {
            "local_path": null,
            "source_url": "https://gateway.gitlink.org.cn/api/file/statics/2026/06/18/梅宏_20250617112044A189_20260618105024A128.png"
          }
        },
        {
          "name": "吕建",
          "affiliation_raw": "中国科学院院士、南京大学教授",
          "photo": {
            "local_path": null,
            "source_url": "https://gateway.gitlink.org.cn/api/file/statics/2026/06/18/吕建_20250617112206A191_20260618105054A129.png"
          }
        },
        {
          "name": "王怀民",
          "affiliation_raw": "大会主席、中国科学院院士、CCF开源发展技术委员会主任",
          "photo": {
            "local_path": null,
            "source_url": "https://gateway.gitlink.org.cn/api/file/statics/2026/06/18/王怀民_20250619112844A244_20260618105129A130.jpg"
          }
        },
        {
          "name": "郑纬民",
          "affiliation_raw": "中国工程院院士、清华大学教授",
          "photo": {
            "local_path": null,
            "source_url": "https://gateway.gitlink.org.cn/api/file/statics/2026/06/18/郑纬民_20250620185405A291_20260618105154A131.png"
          }
        },
        {
          "name": "金海",
          "affiliation_raw": "CCF副理事长、华中科技大学教授",
          "photo": {
            "local_path": null,
            "source_url": "https://gateway.gitlink.org.cn/api/file/statics/2026/06/18/金海_20250617112302A192_20260618105220A132.png"
          }
        },
        {
          "name": "包云岗",
          "affiliation_raw": "中国科学院计算技术研究所副所长、研究员",
          "photo": {
            "local_path": null,
            "source_url": "https://gateway.gitlink.org.cn/api/file/statics/2026/06/18/包云岗_20250617112542A194_20260618105251A133.png"
          }
        },
        {
          "name": "陈海波",
          "affiliation_raw": "上海交通大学特聘教授、CCF开源发展技术委员会常委、OpenHarmony项目群技术指导委员会主席",
          "photo": {
            "local_path": null,
            "source_url": "https://gateway.gitlink.org.cn/api/file/statics/2026/06/18/陈海波_20250619185713A263_20260618105320A134.png"
          }
        },
        {
          "name": "陈康",
          "affiliation_raw": "清华大学计算机系研究员",
          "photo": {
            "local_path": null,
            "source_url": "https://gateway.gitlink.org.cn/api/file/statics/2026/06/20/陈康_20260620114225A141.jpg"
          }
        },
        {
          "name": "陈云霁",
          "affiliation_raw": "中国科学院计算技术研究所副所长、研究员",
          "photo": {
            "local_path": null,
            "source_url": "https://gateway.gitlink.org.cn/api/file/statics/2026/06/20/陈云霁_20260620114146A140.jpg"
          }
        },
        {
          "name": "范科峰",
          "affiliation_raw": "中国电子技术标准化研究院副院长",
          "photo": {
            "local_path": null,
            "source_url": "https://gateway.gitlink.org.cn/api/file/statics/2026/06/20/范科峰_20260620114336A142.jpg"
          }
        },
        {
          "name": "管海兵",
          "affiliation_raw": "上海交通大学副校长、教授",
          "photo": {
            "local_path": null,
            "source_url": "https://gateway.gitlink.org.cn/api/file/statics/2026/06/20/管海兵_20260620114402A143.jpg"
          }
        },
        {
          "name": "郭耀",
          "affiliation_raw": "北京大学计算机学院副院长、教授",
          "photo": {
            "local_path": null,
            "source_url": "https://gateway.gitlink.org.cn/api/file/statics/2026/06/20/郭耀_20260620114428A144.jpg"
          }
        },
        {
          "name": "侯锐",
          "affiliation_raw": "中国科学院信息工程研究所研究员",
          "photo": {
            "local_path": null,
            "source_url": "https://gateway.gitlink.org.cn/api/file/statics/2026/06/20/侯锐_20260620114455A145.png"
          }
        },
        {
          "name": "胡欣蔚",
          "affiliation_raw": "openEuler社区技术委员会主席",
          "photo": {
            "local_path": null,
            "source_url": "https://gateway.gitlink.org.cn/api/file/statics/2026/06/20/胡欣蔚_20260620114521A146.png"
          }
        },
        {
          "name": "李青山",
          "affiliation_raw": "西安电子科技大学计算机科学与技术学院（国家示范性软件学院）党委书记、教授",
          "photo": {
            "local_path": null,
            "source_url": "https://gateway.gitlink.org.cn/api/file/statics/2026/06/20/李青山_20260620114552A147.png"
          }
        },
        {
          "name": "刘旭东",
          "affiliation_raw": "北京航空航天大学计算机学院教授",
          "photo": {
            "local_path": null,
            "source_url": "https://gateway.gitlink.org.cn/api/file/statics/2026/06/20/刘旭东_20260620114639A148.jpg"
          }
        },
        {
          "name": "彭鑫",
          "affiliation_raw": "复旦大学计算与智能创新学院副院长",
          "photo": {
            "local_path": null,
            "source_url": "https://gateway.gitlink.org.cn/api/file/statics/2026/06/20/彭鑫_20260620115457A149.png"
          }
        },
        {
          "name": "乔宇",
          "affiliation_raw": "上海人工智能实验室领军科学家",
          "photo": {
            "local_path": null,
            "source_url": "https://gateway.gitlink.org.cn/api/file/statics/2026/06/20/乔宇_20260620120630A161.png"
          }
        },
        {
          "name": "任旭东",
          "affiliation_raw": "华为首席开源联络官",
          "photo": {
            "local_path": null,
            "source_url": "https://gateway.gitlink.org.cn/api/file/statics/2026/06/20/任旭东_20260620120601A160.jpg"
          }
        },
        {
          "name": "田广礼",
          "affiliation_raw": "天工开物开源基金会理事长",
          "photo": {
            "local_path": null,
            "source_url": "https://gateway.gitlink.org.cn/api/file/statics/2026/06/20/田广礼_20260620120531A159.jpg"
          }
        },
        {
          "name": "王兴兴",
          "affiliation_raw": "宇树科技创始人",
          "photo": {
            "local_path": null,
            "source_url": "https://gateway.gitlink.org.cn/api/file/statics/2026/06/20/王兴兴_20260620120459A158.jpg"
          }
        },
        {
          "name": "韦韬",
          "affiliation_raw": "蚂蚁集团副总裁、首席技术安全官",
          "photo": {
            "local_path": null,
            "source_url": "https://gateway.gitlink.org.cn/api/file/statics/2026/06/20/韦韬_20260620113327A139.png"
          }
        },
        {